{
  "module": "subscriptions",
  "generated_from_fixture": true,
  "overall_source_health": "healthy",
  "conflict_status": "none",
  "pending_or_unknown_final_outcome": false,
  "missing_stay_ai_final_state_warning": null,
  "portal_completion_warning": "Portal link sent without confirmed completion remains incomplete.",
  "shopify_context_warning": "Shopify data is context-only and cannot finalize cancellation or retention outcomes.",
  "sources": [
    {
      "source_system": "stay_ai",
      "source_authority_level": "authoritative_final_state",
      "record_count": 120,
      "last_seen_at": "2026-05-04T09:55:00Z",
      "freshness_status": "fresh",
      "freshness_minutes": 5,
      "source_confirmation_status": "confirmed",
      "data_quality_status": "passing",
      "conflict_count": 0,
      "missing_required_fields": [],
      "lineage_reference": "ingestion.stayai.subscription_state.v1",
      "owner": "analytics",
      "formula_version": "v0.5.0",
      "audit_reference": "audit-source-health-baseline-20260504",
      "trust_label": "high",
      "presentation": {
        "display_label": "Stay Ai Source Health",
        "short_label": "Stay Ai",
        "executive_summary": "Stay Ai provides final-state authority and is monitored for confirmation, freshness, and quality.",
        "format_type": "status_badge",
        "unit": "status",
        "trend_direction": "unknown",
        "comparison_label": "Comparison baseline unavailable in fixture preview",
        "comparison_value": null,
        "severity": "success",
        "visual_tone": "positive",
        "source_authority_explanation": "Stay.ai is the source of truth for final subscription state and outcome confirmation.",
        "trust_explanation": "Trust is high because Stay.ai confirmation is present for final state-sensitive paths.",
        "freshness_explanation": "Data freshness is within the expected update window.",
        "drilldown_hint": "Inspect lineage and missing fields for stay_ai.",
        "empty_state_copy": "No stay_ai records were present in this filtered view.",
        "blocked_state_copy": "Source health is blocked when source extraction or confirmation telemetry is unavailable."
      }
    },
    {
      "source_system": "synthflow",
      "source_authority_level": "journey_event_authoritative",
      "record_count": 148,
      "last_seen_at": "2026-05-04T09:53:00Z",
      "freshness_status": "fresh",
      "freshness_minutes": 7,
      "source_confirmation_status": "confirmed",
      "data_quality_status": "passing",
      "conflict_count": 0,
      "missing_required_fields": [],
      "lineage_reference": "ingestion.synthflow.call_journey.v1",
      "owner": "analytics",
      "formula_version": "v0.5.0",
      "audit_reference": "audit-source-health-baseline-20260504",
      "trust_label": "high",
      "presentation": {
        "display_label": "Synthflow Source Health",
        "short_label": "Synthflow",
        "executive_summary": "Synthflow contributes journey evidence and quality signals without final-state authority.",
        "format_type": "status_badge",
        "unit": "status",
        "trend_direction": "unknown",
        "comparison_label": "Comparison baseline unavailable in fixture preview",
        "comparison_value": null,
        "severity": "success",
        "visual_tone": "positive",
        "source_authority_explanation": "Synthflow is authoritative for support journey events, not final subscription status.",
        "trust_explanation": "Trust is high because Stay.ai confirmation is present for final state-sensitive paths.",
        "freshness_explanation": "Data freshness is within the expected update window.",
        "drilldown_hint": "Inspect lineage and missing fields for synthflow.",
        "empty_state_copy": "No synthflow records were present in this filtered view.",
        "blocked_state_copy": "Source health is blocked when source extraction or confirmation telemetry is unavailable."
      }
    },
    {
      "source_system": "shopify",
      "source_authority_level": "context_only",
      "record_count": 116,
      "last_seen_at": "2026-05-04T09:51:00Z",
      "freshness_status": "fresh",
      "freshness_minutes": 9,
      "source_confirmation_status": "confirmed",
      "data_quality_status": "passing",
      "conflict_count": 0,
      "missing_required_fields": [],
      "lineage_reference": "ingestion.shopify.order_context.v1",
      "owner": "analytics",
      "formula_version": "v0.5.0",
      "audit_reference": "audit-source-health-baseline-20260504",
      "trust_label": "medium",
      "presentation": {
        "display_label": "Shopify Source Health",
        "short_label": "Shopify",
        "executive_summary": "Shopify remains context-only for subscription analytics and does not finalize outcomes.",
        "format_type": "status_badge",
        "unit": "status",
        "trend_direction": "unknown",
        "comparison_label": "Comparison baseline unavailable in fixture preview",
        "comparison_value": null,
        "severity": "success",
        "visual_tone": "positive",
        "source_authority_explanation": "Shopify provides context only and never overrides Stay.ai outcome decisions.",
        "trust_explanation": "Trust is high because Stay.ai confirmation is present for final state-sensitive paths.",
        "freshness_explanation": "Data freshness is within the expected update window.",
        "drilldown_hint": "Inspect lineage and missing fields for shopify.",
        "empty_state_copy": "No shopify records were present in this filtered view.",
        "blocked_state_copy": "Source health is blocked when source extraction or confirmation telemetry is unavailable."
      }
    },
    {
      "source_system": "portal",
      "source_authority_level": "completion_signal",
      "record_count": 16,
      "last_seen_at": "2026-05-04T09:48:00Z",
      "freshness_status": "fresh",
      "freshness_minutes": 12,
      "source_confirmation_status": "pending",
      "data_quality_status": "warning",
      "conflict_count": 0,
      "missing_required_fields": ["confirmed_completion_event_id"],
      "lineage_reference": "ingestion.portal.completion_signal.v1",
      "owner": "analytics",
      "formula_version": "v0.5.0",
      "audit_reference": "audit-source-health-baseline-20260504",
      "trust_label": "medium",
      "presentation": {
        "display_label": "Portal Source Health",
        "short_label": "Portal",
        "executive_summary": "Portal events are completion signals; sent links remain incomplete until completion is confirmed.",
        "format_type": "status_badge",
        "unit": "status",
        "trend_direction": "unknown",
        "comparison_label": "Comparison baseline unavailable in fixture preview",
        "comparison_value": null,
        "severity": "warning",
        "visual_tone": "caution",
        "source_authority_explanation": "Portal events indicate completion signals; link sent does not imply completion.",
        "trust_explanation": "Trust is medium because some records are still pending Stay.ai confirmation.",
        "freshness_explanation": "Data freshness is within the expected update window.",
        "drilldown_hint": "Inspect lineage and missing fields for portal.",
        "empty_state_copy": "No portal records were present in this filtered view.",
        "blocked_state_copy": "Source health is blocked when source extraction or confirmation telemetry is unavailable."
      }
    }
  ],
  "metadata": {
    "timestamp": "2026-05-04T10:00:00Z",
    "fingerprint": "2df86f4cb350c9e7106f45a6b8d4641e0e601af7840dbb57fe8e020b8abff91a",
    "formula_version": "v0.5.0",
    "owner": "analytics",
    "audit_reference": "audit-source-health-baseline-20260504",
    "presentation": {
      "display_label": "Subscription Source Health",
      "short_label": "Source Health",
      "executive_summary": "Source authority and quality posture are shown per system without inferring final outcomes from non-authoritative data.",
      "format_type": "status_summary",
      "unit": "status",
      "trend_direction": "unknown",
      "comparison_label": "Comparison baseline unavailable in fixture preview",
      "comparison_value": null,
      "severity": "info",
      "visual_tone": "neutral",
      "source_authority_explanation": "Stay.ai is the source of truth for final subscription state and outcome confirmation.",
      "trust_explanation": "Trust labels are system-calculated from confirmation and data-quality status and are not manual.",
      "freshness_explanation": "Source freshness is evaluated independently per source system.",
      "drilldown_hint": "Use the sources list for lineage and missing-field diagnostics per source.",
      "empty_state_copy": "No source-health records matched the selected filters.",
      "blocked_state_copy": "Source health is blocked while governed ingestion evidence is unavailable."
    }
  }
}
